name,active_from,active_to,birth_date,position,ppg,trb,ast,height_inches,weight,shooting_hand,draft,college,high_school,url
Robert Archibald,2003,2004,"March 29, 1980",F,1.2,1.6,0.4,83.0,250,Right,"Memphis Grizzlies, 2nd round (3rd pick, 32nd overall), 2002 NBA Draft",University of Illinois at Urbana-Champaign,"Lafayette  in  Ballwin,        Missouri",/players/a/archiro01.html
Tiny Archibald,1971,1984,"September 2, 1948",G,18.8,2.3,7.4,73.0,150,Left,"Cincinnati Royals, 2nd round (2nd pick, 19th overall), 1970 NBA Draft",University of Texas at El Paso,"DeWitt Clinton  in  Bronx,        New York",/players/a/architi01.html
Ryan Arcidiacono,2018,2018,"March 26, 1994",G,2.0,1.0,1.5,75.0,188,Right,,Villanova University,"Neshaminy  in  Langhorne,        Pennsylvania",/players/a/arcidry01.html
Jim Ard,1971,1978,"September 19, 1948",F-C,4.4,4.3,0.6,80.0,215,Right,"Seattle SuperSonics, 1st round (6th pick, 6th overall), 1970 NBA Draft",University of Cincinnati,"Thornton Township  in  Harvey,        Illinois",/players/a/ardji01.html
Gilbert Arenas,2002,2012,"January 6, 1982",G,20.7,3.9,5.3,75.0,191,Right,"Golden State Warriors, 2nd round (2nd pick, 31st overall), 2001 NBA Draft",University of Arizona,"Grant  in  Van Nuys,        California",/players/a/arenagi01.html
Trevor Ariza,2005,2018,"June 30, 1985",F,10.5,4.8,2.1,80.0,215,Right,"New York Knicks, 2nd round (14th pick, 43rd overall), 2004 NBA Draft","University of California, Los Angeles","Westchester  in  Los Angeles,        California",/players/a/arizatr01.html
Paul Arizin,1951,1962,"April 9, 1928",F-G,22.8,8.6,2.3,76.0,190,Right,"Philadelphia Warriors, 1950 NBA Draft (territorial selection)",Villanova University,"La Salle College  in  Philadelphia,        Pennsylvania",/players/a/arizipa01.html
Joe Arlauckas,1988,1988,"July 20, 1965",F,3.8,1.4,0.9,81.0,230,Right,"Sacramento Kings, 4th round (5th pick, 74th overall), 1987 NBA Draft",Niagara University,"Jefferson  in  Rochester,        New York",/players/a/arlaujo01.html
B.J. Armstrong,1990,2000,"September 9, 1967",G,9.8,1.8,3.3,74.0,175,Right,"Chicago Bulls, 1st round (18th pick, 18th overall), 1989 NBA Draft",University of Iowa,"Brother Rice  in  Birmingham,        Michigan",/players/a/armstbj01.html
Bob Armstrong,1957,1957,"June 17, 1933",C-F,1.5,2.1,0.2,80.0,220,Right,"Rochester Royals, 1955 NBA Draft",Michigan State University,,/players/a/armstbo01.html
Brandon Armstrong,2002,2004,"June 16, 1980",G,2.2,0.6,0.2,77.0,188,Left,"Houston Rockets, 1st round (23rd pick, 23rd overall), 2001 NBA Draft",Pepperdine University,"Vallejo  in  Vallejo,        California",/players/a/armstbr01.html
Curly Armstrong,1949,1951,"November 1, 1918",G-F,6.8,2.3,2.3,71.0,170,Right,,Indiana University,"Central  in  Fort Wayne,        Indiana",/players/a/armstcu01.html
Darrell Armstrong,1995,2008,"June 22, 1968",G,9.2,2.7,4.0,72.0,170,Right,,Fayetteville State University,"Ashbrook  in  Gastonia,        North Carolina",/players/a/armstda01.html
Hilton Armstrong,2007,2014,"November 11, 1984",F-C,3.0,2.6,0.3,83.0,235,Right,"New Orleans/Oklahoma City Hornets, 1st round (12th pick, 12th overall), 2006 NBA Draft",University of Connecticut,"Peekskill  in  Peekskill,        New York",/players/a/armsthi01.html
Tate Armstrong,1978,1979,"October 5, 1955",G,3.8,1.0,1.1,75.0,175,Right,"Chicago Bulls, 1st round (13th pick, 13th overall), 1977 NBA Draft",Duke University,"Spring Woods  in  Houston,        Texas",/players/a/armstta01.html
Jesse Arnelle,1956,1956,"December 30, 1933",F,4.7,5.5,0.6,77.0,220,Right,"Fort Wayne Pistons, 2nd round (7th pick, 13th overall), 1955 NBA Draft",Pennsylvania State University,"New Rochelle  in  New Rochelle,        New York",/players/a/arnelje01.html
Jay Arnette,1964,1966,"December 19, 1938",G,3.7,1.0,1.2,74.0,175,Right,"Cincinnati Royals, 2nd round (1st pick, 9th overall), 1960 NBA Draft",University of Texas at Austin,"McCallum  in  Austin,        Texas",/players/a/arnetja01.html
Bob Arnzen,1970,1974,"November 3, 1947",F,4.0,2.0,0.3,77.0,205,Right,"Detroit Pistons, 8th round (4th pick, 103rd overall), 1969 NBA Draft",University of Notre Dame,"Saint Xavier  in  Cincinnati,        Ohio",/players/a/arnzebo01.html
Carlos Arroyo,2002,2011,"July 30, 1979",G,6.6,1.7,3.1,74.0,202,Right,,Florida International University,"Colegio Santiago Apostol  in  Fajardo,      Puerto Rico  ",/players/a/arroyca01.html
Darrell Arthur,2009,2018,"March 25, 1988",F,6.5,3.5,0.8,81.0,235,Right,"New Orleans Hornets, 1st round (27th pick, 27th overall), 2008 NBA Draft",University of Kansas,"South Oak Cliff  in  Dallas,        Texas",/players/a/arthuda01.html
John Arthurs,1970,1970,"August 15, 1947",G,3.2,1.3,1.5,76.0,185,Right,"Milwaukee Bucks, 6th round (2nd pick, 73rd overall), 1969 NBA Draft",Tulane University,"De La Salle  in  New Orleans,        Louisiana",/players/a/arthujo01.html
Jamel Artis,2018,2018,"January 12, 1993",G-F,5.1,2.5,1.2,79.0,213,Right,,University of Pittsburgh,"Notre Dame Prep  in  Fitchburg,        Massachusetts",/players/a/artisja01.html
Omer Asik,2011,2018,"July 4, 1986",C,5.3,7.1,0.6,84.0,255,Right,"Portland Trail Blazers, 2nd round (6th pick, 36th overall), 2008 NBA Draft",,,/players/a/asikom01.html
Vincent Askew,1988,1998,"February 28, 1966",G-F,7.1,2.5,2.2,78.0,210,Right,"Philadelphia 76ers, 2nd round (16th pick, 39th overall), 1987 NBA Draft",University of Memphis,"Frayser  in  Memphis,        Tennessee",/players/a/askewvi01.html
Keith Askins,1991,1999,"December 15, 1967",G-F,3.8,2.9,0.8,79.0,197,Right,,University of Alabama,"Athens  in  Athens,        Alabama",/players/a/askinke01.html
Don Asmonga,1954,1954,"February 15, 1928",G,0.7,0.1,0.7,74.0,185,Right,,Alliance College,"Homestead  in  Homestead,        Pennsylvania",/players/a/asmondo01.html
Dick Atha,1956,1958,"September 21, 1931",G,3.2,1.5,1.2,74.0,190,Right,"New York Knicks, 1953 NBA Draft",Indiana State University,"Otterbein  in  Otterbein,        Indiana",/players/a/athadi01.html
Chucky Atkins,2000,2010,"August 14, 1974",G,9.9,1.7,3.4,71.0,160,Right,,University of South Florida,"Evans  in  Orlando,        Florida",/players/a/atkinch01.html
Al Attles,1961,1971,"November 7, 1936",G,8.9,3.5,3.5,72.0,175,Right,"Philadelphia Warriors, 5th round (7th pick, 39th overall), 1960 NBA Draft",North Carolina Agricultural and Technical State University,"Weequahic  in  Newark,        New Jersey",/players/a/attleal01.html
Chet Aubuchon,1947,1947,"May 18, 1916",G,,,,70.0,137,,,Michigan State University,,/players/a/aubucch01.html
Stacey Augmon,1992,2006,"August 1, 1968",F-G,8.0,3.2,1.6,80.0,205,Left,"Atlanta Hawks, 1st round (9th pick, 9th overall), 1991 NBA Draft","University of Nevada, Las Vegas","John Muir  in  Pasadena,        California",/players/a/augmost01.html
D.J. Augustin,2009,2018,"November 10, 1987",G,9.6,1.8,3.8,72.0,183,Right,"Charlotte Bobcats, 1st round (9th pick, 9th overall), 2008 NBA Draft",University of Texas at Austin,"Hightower  in  Missouri City,        Texas",/players/a/augusdj01.html
James Augustine,2007,2008,"February 27, 1984",F,1.6,1.2,0.1,82.0,235,Left,"Orlando Magic, 2nd round (11th pick, 41st overall), 2006 NBA Draft",University of Illinois at Urbana-Champaign,"Lincoln-Way Central  in  Mokena,        Illinois",/players/a/augusja01.html
Isaac Austin,1992,2002,"August 18, 1969",C,7.6,4.7,1.2,82.0,255,Right,"Utah Jazz, 2nd round (21st pick, 48th overall), 1991 NBA Draft",Arizona State University,"Las Plumas  in  Oroville,        California",/players/a/austiis01.html
Johnny Austin,1967,1968,"August 31, 1944",G,7.6,1.6,1.4,72.0,170,Right,"Boston Celtics, 4th round (8th pick, 38th overall), 1966 NBA Draft",Boston College,"DeMatha Catholic  in  Hyattsville,        Maryland",/players/a/austijo01.html
Ken Austin,1984,1984,"July 15, 1961",F,1.7,0.4,0.1,81.0,205,Right,"Detroit Pistons, 5th round (8th pick, 101st overall), 1983 NBA Draft",Rice University,"Verbum Dei  in  Los Angeles,        California",/players/a/austike01.html
Anthony Avent,1993,2000,"October 18, 1969",F,5.6,4.5,0.8,81.0,235,Right,"Atlanta Hawks, 1st round (15th pick, 15th overall), 1991 NBA Draft",Seton Hall University,"Malcolm X Shabazz  in  Newark,        New Jersey",/players/a/aventan01.html
Bird Averitt,1974,1978,"July 22, 1952",G,12.1,1.9,2.9,73.0,170,Left,,Pepperdine University,"Hopkinsville  in  Hopkinsville,        Kentucky",/players/a/averibi01.html
William Avery,2000,2002,"August 8, 1979",G,2.7,0.7,1.4,74.0,197,Right,"Minnesota Timberwolves, 1st round (14th pick, 14th overall), 1999 NBA Draft",Duke University,"Oak Hill Academy  in  Mouth of Wilson,        Virginia",/players/a/averywi01.html
Dennis Awtrey,1971,1982,"February 22, 1948",C,4.8,4.6,2.0,82.0,235,Right,"Philadelphia 76ers, 3rd round (12th pick, 46th overall), 1970 NBA Draft",Santa Clara University,"Blackford  in  San Jose,        California",/players/a/awtrede01.html
Gustavo Ayon,2012,2014,"April 1, 1985",C,4.7,4.4,1.3,82.0,250,Right,,,,/players/a/ayongu01.html
Jeff Ayres,2010,2016,"April 29, 1987",F,2.9,2.7,0.4,81.0,240,Right,"Sacramento Kings, 2nd round (1st pick, 31st overall), 2009 NBA Draft",Arizona State University,"Etiwanda  in  Rancho Cucamonga,        California",/players/p/pendeje02.html
Kelenna Azubuike,2007,2012,"December 16, 1983",G,10.5,4.0,1.1,77.0,220,Right,,University of Kentucky,"Victory Christian  in  Tulsa,        Oklahoma",/players/a/azubuke01.html
