name,active_from,active_to,birth_date,position,ppg,trb,ast,height_inches,weight,shooting_hand,draft,college,high_school,url
Alaa Abdelnaby,1991,1995,"June 24, 1968",F-C,5.7,3.3,0.3,82.0,240,Right,"Portland Trail Blazers, 1st round (25th pick, 25th overall), 1990 NBA Draft",Duke University,"Bloomfield  in  Bloomfield,        New Jersey",/players/a/abdelal01.html
Zaid Abdul-Aziz,1969,1978,"April 7, 1946",C-F,9.0,8.0,1.2,81.0,235,Right,"Cincinnati Royals, 1st round (5th pick, 5th overall), 1968 NBA Draft",Iowa State University,"John Jay  in  Brooklyn,        New York",/players/a/abdulza01.html
Kareem Abdul-Jabbar,1970,1989,"April 16, 1947",C,24.6,11.2,3.6,86.0,225,Right,"Milwaukee Bucks, 1st round (1st pick, 1st overall), 1969 NBA Draft","University of California, Los Angeles","Power Memorial  in  New York,        New York",/players/a/abdulka01.html
Mahmoud Abdul-Rauf,1991,2001,"March 9, 1969",G,14.6,1.9,3.5,73.0,162,Right,"Denver Nuggets, 1st round (3rd pick, 3rd overall), 1990 NBA Draft",Louisiana State University,"Gulfport  in  Gulfport,        Mississippi",/players/a/abdulma02.html
Tariq Abdul-Wahad,1998,2003,"November 3, 1974",F,7.8,3.3,1.1,78.0,223,Right,"Sacramento Kings, 1st round (11th pick, 11th overall), 1997 NBA Draft","University of Michigan, San Jose State University","Lycee Aristide Briand  in  Evreux,      France  ",/players/a/abdulta01.html
Shareef Abdur-Rahim,1997,2008,"December 11, 1976",F,18.1,7.5,2.5,81.0,225,Right,"Vancouver Grizzlies, 1st round (3rd pick, 3rd overall), 1996 NBA Draft",University of California,"Wheeler  in  Marietta,        Georgia",/players/a/abdursh01.html
Tom Abernethy,1977,1981,"May 6, 1954",F,5.6,3.2,1.2,79.0,220,Right,"Los Angeles Lakers, 3rd round (9th pick, 43rd overall), 1976 NBA Draft",Indiana University,"Saint Joseph  in  South Bend,        Indiana",/players/a/abernto01.html
Forest Able,1957,1957,"July 27, 1932",G,0.0,1.0,1.0,75.0,180,Right,"Syracuse Nationals, 1956 NBA Draft",Western Kentucky University,"Fairdale  in  Louisville,        Kentucky",/players/a/ablefo01.html
John Abramovic,1947,1948,"February 9, 1919",F,,,,75.0,195,,,Salem International University,,/players/a/abramjo01.html
Alex Abrines,2017,2018,"August 1, 1993",G-F,5.3,1.4,0.5,78.0,190,Right,"Oklahoma City Thunder, 2nd round (2nd pick, 32nd overall), 2013 NBA Draft",,,/players/a/abrinal01.html
Alex Acker,2006,2009,"January 21, 1983",G,2.7,1.0,0.5,77.0,185,Right,"Detroit Pistons, 2nd round (30th pick, 60th overall), 2005 NBA Draft",Pepperdine University,"Eisenhower  in  Rialto,        California",/players/a/ackeral01.html
Don Ackerman,1954,1954,"September 4, 1930",G,1.5,0.5,0.8,72.0,183,Right,"New York Knicks, 2nd round, 1953 NBA Draft",Long Island University,"Metropolitan  in  New York,        New York",/players/a/ackerdo01.html
Mark Acres,1988,1993,"November 15, 1962",F-C,3.6,4.1,0.5,83.0,220,Right,"Dallas Mavericks, 2nd round (16th pick, 40th overall), 1985 NBA Draft",Oral Roberts University,"Palos Verdes  in  Palos Verdes Estates,        California",/players/a/acresma01.html
Bud Acton,1968,1968,"January 11, 1942",F,3.3,2.0,0.5,78.0,210,Right,,Hillsdale College,"Troy  in  Troy,        Michigan",/players/a/actonbu01.html
Quincy Acy,2013,2018,"October 6, 1990",F,5.0,3.5,0.6,79.0,240,Right,"Toronto Raptors, 2nd round (7th pick, 37th overall), 2012 NBA Draft",Baylor University,"Mesquite Horn  in  Mesquite,        Texas",/players/a/acyqu01.html
Alvan Adams,1976,1988,"July 19, 1954",C-F,14.1,7.0,4.1,81.0,210,Right,"Phoenix Suns, 1st round (4th pick, 4th overall), 1975 NBA Draft",University of Oklahoma,"Putnam City  in  Warr Acres,        Oklahoma",/players/a/adamsal01.html
Don Adams,1971,1977,"November 27, 1947",F,8.8,5.6,1.9,78.0,210,Right,"San Diego Rockets, 8th round (1st pick, 120th overall), 1970 NBA Draft",Northwestern University,"South Fulton  in  South Fulton,        Georgia",/players/a/adamsdo01.html
George Adams,1973,1975,"May 15, 1949",F-G,7.7,4.1,1.5,77.0,210,Right,"Milwaukee Bucks, 3rd round (16th pick, 46th overall), 1972 NBA Draft",Gardner-Webb University,,/players/a/adamsge01.html
Hassan Adams,2007,2009,"June 20, 1984",G,2.5,1.2,0.2,76.0,220,Right,"New Jersey Nets, 2nd round (24th pick, 54th overall), 2006 NBA Draft",University of Arizona,"Westchester  in  Los Angeles,        California",/players/a/adamsha01.html
Jordan Adams,2015,2016,"July 8, 1994",G,3.2,0.9,0.6,77.0,209,Right,"Memphis Grizzlies, 1st round (22nd pick, 22nd overall), 2014 NBA Draft","University of California, Los Angeles","Oak Hill Academy  in  Mouth of Wilson,        Virginia",/players/a/adamsjo01.html
Michael Adams,1986,1996,"January 19, 1963",G,14.7,2.9,6.4,70.0,162,Right,"Sacramento Kings, 3rd round (19th pick, 66th overall), 1985 NBA Draft",Boston College,"Hartford Public  in  Hartford,        Connecticut",/players/a/adamsmi01.html
Steven Adams,2014,2018,"July 20, 1993",C,8.8,6.9,0.9,84.0,255,Right,"Oklahoma City Thunder, 1st round (12th pick, 12th overall), 2013 NBA Draft",University of Pittsburgh,"Notre Dame Preparatory School  in  Fitchburg,        Massachusetts",/players/a/adamsst01.html
Rafael Addison,1987,1997,"July 22, 1964",F-G,5.8,2.1,0.9,79.0,215,Right,"Phoenix Suns, 2nd round (15th pick, 39th overall), 1986 NBA Draft",Syracuse University,"Snyder  in  Jersey City,        New Jersey",/players/a/addisra01.html
Bam Adebayo,2018,2018,"July 18, 1997",C-F,6.9,5.5,1.5,82.0,243,Right,"Miami Heat, 1st round (14th pick, 14th overall), 2017 NBA Draft",University of Kentucky,"High Point Christian Academy  in  High Point,        North Carolina",/players/a/adebaba01.html
Rick Adelman,1969,1975,"June 16, 1946",G,7.7,2.4,3.5,73.0,175,Right,"San Diego Rockets, 7th round (1st pick, 79th overall), 1968 NBA Draft",Loyola Marymount University,"Saint Pius X  in  Downey,        California",/players/a/adelmri01.html
Jeff Adrien,2011,2015,"February 10, 1986",F,4.6,4.3,0.7,79.0,245,Right,,University of Connecticut,"Brewster Academy  in  Wolfeboro,        New Hampshire",/players/a/adrieje01.html
Arron Afflalo,2008,2018,"October 15, 1985",G,10.8,2.9,1.8,77.0,210,Right,"Detroit Pistons, 1st round (27th pick, 27th overall), 2007 NBA Draft","University of California, Los Angeles","Centennial  in  Compton,        California",/players/a/afflaar01.html
Maurice Ager,2007,2011,"February 9, 1984",G,2.1,0.6,0.2,77.0,202,Right,"Dallas Mavericks, 1st round (28th pick, 28th overall), 2006 NBA Draft",Michigan State University,"Crocket  in  Detroit,        Michigan",/players/a/agerma01.html
Mark Aguirre,1982,1994,"December 10, 1959",F-G,20.0,5.0,3.1,78.0,232,Right,"Dallas Mavericks, 1st round (1st pick, 1st overall), 1981 NBA Draft",DePaul University,"George Westinghouse  in  Chicago,        Illinois",/players/a/aguirma01.html
Blake Ahearn,2008,2012,"May 27, 1984",G,4.6,1.2,1.2,74.0,190,Right,,Missouri State University,"De Smet Jesuit  in  Creve Coeur,        Missouri",/players/a/ahearbl01.html
Danny Ainge,1982,1995,"March 17, 1959",G,11.5,2.7,4.0,76.0,175,Right,"Boston Celtics, 2nd round (8th pick, 31st overall), 1981 NBA Draft",Brigham Young University,"Eugene  in  North Eugene,        Oregon",/players/a/aingeda01.html
Matthew Aitch,1968,1968,"September 21, 1944",F,5.6,3.6,0.4,79.0,230,Right,"Detroit Pistons, 13th round (2nd pick, 135th overall), 1967 NBA Draft",Michigan State University,"Maplewood-Richmond Heights  in  Maplewood,        Missouri",/players/a/aitchma01.html
Alexis Ajinca,2009,2017,"May 6, 1988",C,5.3,3.9,0.5,86.0,248,Right,"Charlotte Bobcats, 1st round (20th pick, 20th overall), 2008 NBA Draft",,,/players/a/ajincal01.html
Henry Akin,1967,1969,"July 31, 1944",C-F,3.5,2.1,0.5,82.0,225,Right,"New York Knicks, 2nd round (1st pick, 11th overall), 1966 NBA Draft",Morehead State University,,/players/a/akinhe01.html
Josh Akognon,2013,2013,"February 10, 1986",G,1.7,0.3,0.3,71.0,185,Right,,"Washington State University, California State University, Fullerton","Casa Grande  in  Petaluma,        California",/players/a/akognjo01.html
Solomon Alabi,2011,2012,"March 21, 1988",C,1.5,2.3,0.2,85.0,251,Right,"Dallas Mavericks, 2nd round (20th pick, 50th overall), 2010 NBA Draft",Florida State University,"Montverde Academy  in  Montverde,        Florida",/players/a/alabiso01.html
Mark Alarie,1987,1991,"December 11, 1963",F,7.5,3.4,1.1,80.0,217,Right,"Denver Nuggets, 1st round (18th pick, 18th overall), 1986 NBA Draft",Duke University,"Brophy College Preparatory  in  Phoenix,        Arizona",/players/a/alarima01.html
Gary Alcorn,1960,1961,"October 8, 1936",C,3.3,4.2,0.3,81.0,225,Right,"Detroit Pistons, 3rd round (2nd pick, 16th overall), 1959 NBA Draft","California State University, Fresno",,/players/a/alcorga01.html
Furkan Aldemir,2015,2015,"August 9, 1991",F-C,2.3,4.3,0.7,82.0,240,Right,"Los Angeles Clippers, 2nd round (23rd pick, 53rd overall), 2012 NBA Draft",,,/players/a/aldemfu01.html
Cole Aldrich,2011,2018,"October 31, 1988",C,3.1,3.3,0.5,83.0,250,Right,"New Orleans Hornets, 1st round (11th pick, 11th overall), 2010 NBA Draft",University of Kansas,"Thomas Jefferson  in  Bloomington,        Minnesota",/players/a/aldrico01.html
LaMarcus Aldridge,2007,2018,"July 19, 1985",F-C,19.4,8.3,1.9,83.0,260,Right,"Chicago Bulls, 1st round (2nd pick, 2nd overall), 2006 NBA Draft",University of Texas at Austin,"Seagoville  in  Seagoville,        Texas",/players/a/aldrila01.html
Chuck Aleksinas,1985,1985,"February 26, 1959",C,5.1,3.6,0.5,83.0,260,Right,"Chicago Bulls, 4th round (7th pick, 76th overall), 1982 NBA Draft","University of Kentucky, University of Connecticut","Wamogo  in  Litchfield,        Connecticut",/players/a/aleksch01.html
Cliff Alexander,2016,2016,"November 16, 1995",F,1.3,0.8,0.0,80.0,245,Right,,University of Kansas,"Curie  in  Chicago,        Illinois",/players/a/alexacl01.html
Cory Alexander,1996,2005,"June 22, 1973",G,5.5,1.6,2.7,73.0,185,Right,"San Antonio Spurs, 1st round (29th pick, 29th overall), 1995 NBA Draft",University of Virginia,"Oak Hill Academy  in  Mouth of Wilson,        Virginia",/players/a/alexaco01.html
Courtney Alexander,2001,2003,"April 27, 1977",G,9.0,2.2,1.2,77.0,205,Right,"Orlando Magic, 1st round (13th pick, 13th overall), 2000 NBA Draft","University of Virginia, California State University, Fresno","Jordan  in  Durham,        North Carolina",/players/a/alexaco02.html
Gary Alexander,1994,1994,"November 1, 1969",F,1.7,1.4,0.2,79.0,240,Right,,University of South Florida,"William M. Raines  in  Jacksonville,        Florida",/players/a/alexaga01.html
Joe Alexander,2009,2010,"December 26, 1986",F,4.2,1.8,0.7,80.0,230,Right,"Milwaukee Bucks, 1st round (8th pick, 8th overall), 2008 NBA Draft",West Virginia University,"Hargrave Military Academy  in  Chatham,        Virginia",/players/a/alexajo01.html
Victor Alexander,1992,2002,"August 31, 1969",C-F,8.9,4.8,0.9,81.0,265,Right,"Golden State Warriors, 1st round (17th pick, 17th overall), 1991 NBA Draft",Iowa State University,"Denby  in  Detroit,        Michigan",/players/a/alexavi01.html
Steve Alford,1988,1991,"November 23, 1964",G,4.4,0.9,1.0,74.0,183,Right,"Dallas Mavericks, 2nd round (3rd pick, 26th overall), 1987 NBA Draft",Indiana University,"Chrysler  in  New Castle,        Indiana",/players/a/alforst01.html
Bill Allen,1968,1968,,C-F,7.9,7.1,0.6,80.0,205,Right,,New Mexico State University,,/players/a/allenbi01.html
Bob Allen,1969,1969,"July 17, 1946",F,1.8,2.1,0.4,81.0,205,Right,"San Francisco Warriors, 6th round (7th pick, 71st overall), 1968 NBA Draft",Marshall University,,/players/a/allenbo01.html
Jarrett Allen,2018,2018,"April 21, 1998",F-C,8.2,5.4,0.7,82.0,234,Right,"Brooklyn Nets, 1st round (22nd pick, 22nd overall), 2017 NBA Draft",University of Texas at Austin,"St. Stephen's Episcopal School  in  Austin,        Texas",/players/a/allenja01.html
Jerome Allen,1996,1997,"January 28, 1973",G,2.9,1.1,1.7,76.0,184,Right,"Minnesota Timberwolves, 2nd round (20th pick, 49th overall), 1995 NBA Draft",University of Pennsylvania,"Episcopal Academy  in  Merion Station,        Pennsylvania",/players/a/allenje01.html
Kadeem Allen,2018,2018,"January 15, 1993",G,1.1,0.6,0.7,75.0,192,Right,"Boston Celtics, 2nd round (23rd pick, 53rd overall), 2017 NBA Draft",University of Arizona,"New Hanover  in  Wilmington,        North Carolina",/players/a/allenka01.html
Lavoy Allen,2012,2017,"February 4, 1989",F-C,4.8,4.8,1.0,81.0,260,Right,"Philadelphia 76ers, 2nd round (20th pick, 50th overall), 2011 NBA Draft",Temple University,"Pennsbury  in  Fairless Hills,        Pennsylvania",/players/a/allenla01.html
Lucius Allen,1970,1979,"September 26, 1947",G,13.4,3.1,4.5,74.0,175,Right,"Seattle SuperSonics, 1st round (3rd pick, 3rd overall), 1969 NBA Draft","University of California, Los Angeles","Wyandotte  in  Kansas City,        Kansas",/players/a/allenlu01.html
Malik Allen,2002,2011,"June 27, 1978",F-C,4.9,2.8,0.5,82.0,255,Right,,Villanova University,"Shawnee  in  Medford,        New Jersey",/players/a/allenma01.html
Randy Allen,1989,1990,"January 26, 1965",F,3.6,2.1,0.3,80.0,220,Right,,Florida State University,"Milton  in  Milton,        Florida",/players/a/allenra01.html
Ray Allen,1997,2014,"July 20, 1975",G,18.9,4.1,3.4,77.0,205,Right,"Minnesota Timberwolves, 1st round (5th pick, 5th overall), 1996 NBA Draft",University of Connecticut,"Hillcrest  in  Dalzell,        South Carolina",/players/a/allenra02.html
Tony Allen,2005,2018,"January 11, 1982",G-F,8.1,3.5,1.3,76.0,213,Right,"Boston Celtics, 1st round (25th pick, 25th overall), 2004 NBA Draft","Butler County Community College, Oklahoma State University","Crane Technical Preparatory  in  Chicago,        Illinois",/players/a/allento01.html
Willie Allen,1972,1972,"February 8, 1949",F,1.9,2.0,0.6,78.0,230,Right,"Baltimore Bullets, 4th round (9th pick, 60th overall), 1971 NBA Draft",University of Miami,"Richard Montgomery  in  Rockville,        Maryland",/players/a/allenwi01.html
Odis Allison,1972,1972,"October 2, 1949",F,1.9,1.3,0.3,78.0,195,Right,"Golden State Warriors, 5th round (8th pick, 76th overall), 1971 NBA Draft","University of Nevada, Las Vegas","McClymonds  in  Oakland,        California",/players/a/allisod01.html
Lance Allred,2008,2008,"February 2, 1981",C,1.0,0.3,0.0,83.0,250,Right,,"University of Utah, Weber State University","East  in  Salt Lake City,        Utah",/players/a/allrela01.html
Darrell Allums,1981,1981,"September 12, 1958",F,2.7,3.0,1.1,81.0,220,Right,"Dallas Mavericks, 5th round (11th pick, 103rd overall), 1980 NBA Draft","University of California, Los Angeles","Lynwood  in  Lynwood,        California",/players/a/allumda01.html
Morris Almond,2008,2012,"February 2, 1985",G,3.1,1.2,0.3,78.0,225,Right,"Utah Jazz, 1st round (25th pick, 25th overall), 2007 NBA Draft",Rice University,"McEachern  in  Powder Springs,        Georgia",/players/a/almonmo01.html
Derrick Alston,1995,1997,"August 20, 1972",F,5.4,3.8,0.7,83.0,225,Right,"Philadelphia 76ers, 2nd round (6th pick, 33rd overall), 1994 NBA Draft",Duquesne University,"Hoboken  in  Hoboken,        New Jersey",/players/a/alstode01.html
Rafer Alston,2000,2010,"July 24, 1976",G,10.1,2.8,4.8,74.0,171,Right,"Milwaukee Bucks, 2nd round (10th pick, 39th overall), 1998 NBA Draft","California State University, Fresno","Benjamin Cardozo  in  Bayside,        New York",/players/a/alstora01.html
Peter Aluma,1999,1999,"April 23, 1973",C,1.0,1.0,0.0,82.0,260,Right,,Liberty University,"Okota Grammar School  in  Isolo,      Nigeria  ",/players/a/alumape01.html
John Amaechi,1996,2003,"November 26, 1970",C-F,6.2,2.6,0.8,82.0,270,Right,,"Vanderbilt University, Pennsylvania State University","Saint John's  in  Toledo,        Ohio",/players/a/amaecjo01.html
Ashraf Amaya,1996,1997,"November 23, 1971",F,4.5,4.2,0.4,80.0,230,Right,,Southern Illinois University,"Walther Lutheran  in  Melrose Park,        Illinois",/players/a/amayaas01.html
Al-Farouq Aminu,2011,2018,"September 21, 1990",F,7.5,5.9,1.2,81.0,220,Right,"Los Angeles Clippers, 1st round (8th pick, 8th overall), 2010 NBA Draft",Wake Forest University,"Norcross  in  Norcross,        Georgia",/players/a/aminual01.html
Lou Amundson,2007,2016,"December 7, 1982",F,3.7,3.6,0.4,81.0,220,Right,,"University of Nevada, Las Vegas","Monarch  in  Louisville,        Colorado",/players/a/amundlo01.html
Bob Anderegg,1960,1960,"August 24, 1937",F-G,4.0,2.1,0.9,75.0,200,Right,"New York Knicks, 3rd round (6th pick, 20th overall), 1959 NBA Draft",Michigan State University,"Monroe  in  Monroe,        Wisconsin",/players/a/anderbo01.html
Chris Andersen,2002,2017,"July 7, 1978",F-C,5.4,5.0,0.5,82.0,245,Right,,Blinn College,"Iola  in  Iola,        Texas",/players/a/anderch01.html
David Andersen,2010,2011,"June 23, 1980",C,4.9,2.8,0.6,83.0,245,Right,"Atlanta Hawks, 2nd round (8th pick, 37th overall), 2002 NBA Draft",,,/players/a/anderda03.html
Alan Anderson,2006,2017,"October 16, 1982",G-F,7.3,2.2,1.1,78.0,220,Right,,Michigan State University,"DeLaSalle  in  Minneapolis,        Minnesota",/players/a/anderal01.html
Andrew Anderson,1968,1970,"July 6, 1945",G,10.7,2.7,1.7,74.0,184,Right,"Boston Celtics, 8th round (9th pick, 88th overall), 1967 NBA Draft",Canisius College,,/players/a/anderan01.html
Antonio Anderson,2010,2010,"June 5, 1985",G,2.0,1.0,0.0,78.0,215,Right,,University of Memphis,"Laurinburg Institute  in  Laurinburg,        North Carolina",/players/a/anderan02.html
Cliff Anderson,1968,1971,"September 7, 1944",G-F,3.0,1.3,0.9,74.0,200,Right,"Los Angeles Lakers, 4th round (4th pick, 35th overall), 1967 NBA Draft",Saint Joseph's University,"Thomas Edison  in  Philadelphia,        Pennsylvania",/players/a/andercl01.html
Dan Anderson,1968,1969,"February 15, 1943",C,12.2,9.4,1.1,82.0,230,Right,"Philadelphia 76ers, 12th round (3rd pick, 89th overall), 1965 NBA Draft",Augsburg College,,/players/a/anderda01.html
Dan Anderson,1975,1976,"January 1, 1951",G,3.7,1.0,1.7,74.0,185,Right,"Portland Trail Blazers, 6th round (2nd pick, 92nd overall), 1974 NBA Draft",University of Southern California,"North Torrance  in  Torrance,        California",/players/a/anderda02.html
Derek Anderson,1998,2008,"July 18, 1974",G,12.0,3.2,3.4,77.0,194,Right,"Cleveland Cavaliers, 1st round (13th pick, 13th overall), 1997 NBA Draft","Ohio State University, University of Kentucky","Doss  in  Louisville,        Kentucky",/players/a/anderde01.html
Dwight Anderson,1983,1983,"December 28, 1960",G,4.2,0.4,0.6,75.0,185,Right,"Washington Bullets, 2nd round (18th pick, 41st overall), 1982 NBA Draft","University of Kentucky, University of Southern California","Roth  in  Dayton,        Ohio",/players/a/anderdw01.html
Eric Anderson,1993,1994,"May 26, 1970",F,1.6,1.1,0.2,81.0,220,Right,,Indiana University,"Saint Francis DeSales  in  Chicago,        Illinois",/players/a/anderer01.html
Greg Anderson,1988,1998,"June 22, 1964",F-C,7.3,6.2,0.6,82.0,230,Right,"San Antonio Spurs, 1st round (23rd pick, 23rd overall), 1987 NBA Draft",University of Houston,"Evan E. Worthing  in  Houston,        Texas",/players/a/andergr01.html
J.J. Anderson,1983,1985,"September 23, 1960",F,4.8,2.8,0.7,80.0,195,Right,"Philadelphia 76ers, 2nd round (13th pick, 36th overall), 1982 NBA Draft",Bradley University,"Metro  in  Chicago,        Illinois",/players/a/anderjj01.html
James Anderson,2011,2016,"March 25, 1989",G-F,5.8,2.3,1.2,78.0,213,Right,"San Antonio Spurs, 1st round (20th pick, 20th overall), 2010 NBA Draft",Oklahoma State University,"Junction City  in  Junction City,        Arkansas",/players/a/anderja01.html
Jerome Anderson,1976,1977,"October 9, 1953",G,2.6,0.5,0.3,77.0,195,Right,"Boston Celtics, 3rd round (17th pick, 53rd overall), 1975 NBA Draft",West Virginia University,"Mullens  in  Mullens,        West Virginia",/players/a/anderje01.html
Justin Anderson,2016,2018,"November 19, 1993",G,5.8,2.8,0.7,78.0,228,Left,"Dallas Mavericks, 1st round (21st pick, 21st overall), 2015 NBA Draft",University of Virginia,"Montrose Christian  in  Rockville,        Maryland",/players/a/anderju01.html
Kenny Anderson,1992,2005,"October 9, 1970",G,12.6,3.1,6.1,72.0,168,Left,"New Jersey Nets, 1st round (2nd pick, 2nd overall), 1991 NBA Draft",Georgia Institute of Technology,"Archbishop Molloy  in  Jamaica,        New York",/players/a/anderke01.html
Kim Anderson,1979,1979,"May 12, 1955",F,3.0,2.1,0.7,79.0,200,Right,"Portland Trail Blazers, 2nd round (6th pick, 28th overall), 1977 NBA Draft, and Milwaukee Bucks, 7th round (15th pick, 146th overall), 1978 NBA Draft",University of Missouri,"Smith-Cotton  in  Sedali,        Missouri",/players/a/anderki01.html
Kyle Anderson,2015,2018,"September 20, 1993",F-G,4.9,3.6,1.7,81.0,230,Right,"San Antonio Spurs, 1st round (30th pick, 30th overall), 2014 NBA Draft","University of California, Los Angeles","St. Anthony's  in  Jersey City,        New Jersey",/players/a/anderky01.html
Michael Anderson,1989,1989,"March 23, 1966",G,5.7,2.5,4.3,71.0,184,Right,"Indiana Pacers, 3rd round (23rd pick, 73rd overall), 1988 NBA Draft",Drexel University,"George Washington Carver High School of Engineering and Science  in  Philadelphia,        Pennsylvania",/players/a/andermi01.html
Nick Anderson,1990,2002,"January 20, 1968",F-G,14.4,5.1,2.6,78.0,205,Right,"Orlando Magic, 1st round (11th pick, 11th overall), 1989 NBA Draft",University of Illinois at Urbana-Champaign,"Simeon Vocational School  in  Chicago,        Illinois",/players/a/anderni01.html
Richard Anderson,1983,1990,"November 19, 1960",F-C,5.6,3.5,1.5,82.0,240,Right,"San Diego Clippers, 2nd round (9th pick, 32nd overall), 1982 NBA Draft","University of California, Santa Barbara","Rancho Alamitos  in  Garden Grove,        California",/players/a/anderri01.html
Ron Anderson,1985,1994,"October 15, 1958",F-G,10.6,3.5,1.4,79.0,215,Right,"Cleveland Cavaliers, 2nd round (3rd pick, 27th overall), 1984 NBA Draft","California State University, Fresno","Bowen  in  Chicago,        Illinois",/players/a/anderro01.html
Ryan Anderson,2009,2018,"May 6, 1988",F,12.8,5.4,0.9,82.0,240,Right,"New Jersey Nets, 1st round (21st pick, 21st overall), 2008 NBA Draft",University of California,"Oak Ridge  in  El Dorado Hills,        California",/players/a/anderry01.html
Shandon Anderson,1997,2006,"December 31, 1973",F-G,7.4,3.1,1.4,78.0,208,Right,"Utah Jazz, 2nd round (25th pick, 54th overall), 1996 NBA Draft",University of Georgia,"Crim  in  Atlanta,        Georgia",/players/a/andersh01.html
Willie Anderson,1989,1997,"January 8, 1967",G-F,12.2,3.8,3.8,79.0,190,Right,"San Antonio Spurs, 1st round (10th pick, 10th overall), 1988 NBA Draft",University of Georgia,"East Atlanta  in  Atlanta,        Georgia",/players/a/anderwi01.html
Wally Anderzunas,1970,1970,"January 11, 1946",C-F,3.6,1.9,0.2,79.0,220,Right,"Detroit Pistons, 6th round (6th pick, 70th overall), 1968 NBA Draft, and Atlanta Hawks, 2nd round (10th pick, 25th overall), 1969 NBA Draft",Creighton University,"Creighton Preparatory School  in  Omaha,        Nebraska",/players/a/anderwa01.html
Martynas Andriuskevicius,2006,2006,"March 12, 1986",C,0.0,0.7,0.0,86.0,240,Right,"Orlando Magic, 2nd round (14th pick, 44th overall), 2005 NBA Draft",,,/players/a/andrima01.html
Don Anielak,1955,1955,"November 1, 1930",F,3.0,2.0,0.0,79.0,190,Right,"New York Knicks, 3rd round (8th pick, 26th overall), 1954 NBA Draft",Missouri State University,,/players/a/anieldo01.html
Ike Anigbogu,2018,2018,"October 22, 1998",F-C,1.2,0.8,0.0,82.0,252,Right,"Indiana Pacers, 2nd round (17th pick, 47th overall), 2017 NBA Draft","University of California, Los Angeles","Centennial  in  Corono,        California",/players/a/anigbik01.html
Michael Ansley,1990,1992,"February 8, 1967",F,6.9,4.2,0.4,79.0,225,Right,"Orlando Magic, 2nd round (10th pick, 37th overall), 1989 NBA Draft",University of Alabama,"Jackson-Olin  in  Birmingham,        Alabama",/players/a/anslemi01.html
Chris Anstey,1998,2000,"January 1, 1975",C,5.2,3.4,0.8,84.0,249,Right,"Portland Trail Blazers, 1st round (18th pick, 18th overall), 1997 NBA Draft",,"Catholic Regional College  in  Melbourne,      Australia  ",/players/a/anstech01.html
Giannis Antetokounmpo,2014,2018,"December 6, 1994",F-G,17.2,7.5,3.8,83.0,222,Right,"Milwaukee Bucks, 1st round (15th pick, 15th overall), 2013 NBA Draft",,,/players/a/antetgi01.html
Thanasis Antetokounmpo,2016,2016,"July 17, 1992",F,3.0,0.5,0.0,79.0,205,Right,"New York Knicks, 2nd round (21st pick, 51st overall), 2014 NBA Draft",,,/players/a/antetth01.html
Carmelo Anthony,2004,2018,"May 29, 1984",F,24.1,6.5,3.0,80.0,240,Right,"Denver Nuggets, 1st round (3rd pick, 3rd overall), 2003 NBA Draft",Syracuse University,"Oak Hill Academy  in  Mouth of Wilson,        Virginia",/players/a/anthoca01.html
Greg Anthony,1992,2002,"November 15, 1967",G,7.3,1.9,4.0,72.0,176,Left,"New York Knicks, 1st round (12th pick, 12th overall), 1991 NBA Draft","University of Portland, University of Nevada, Las Vegas","Rancho  in  North Las Vegas,        Nevada",/players/a/anthogr01.html
Joel Anthony,2008,2017,"August 9, 1982",C,2.2,2.8,0.2,81.0,245,Left,,"University of Nevada, Las Vegas","Dawson College  in  Montreal,      Canada  ",/players/a/anthojo01.html
Pero Antic,2014,2015,"July 29, 1982",C-F,6.3,3.5,0.9,83.0,260,Right,,,,/players/a/anticpe01.html
OG Anunoby,2018,2018,"July 17, 1997",F,5.9,2.5,0.7,80.0,232,Right,"Toronto Raptors, 1st round (23rd pick, 23rd overall), 2017 NBA Draft",Indiana University,"Jefferson City  in  Jefferson City,        Missouri",/players/a/anunoog01.html
Keith Appling,2016,2016,"February 13, 1992",G,1.2,0.2,0.2,73.0,185,Right,,Michigan State University,"Pershing  in  Detroit,        Michigan",/players/a/applike01.html
Rafael Araujo,2005,2007,"August 12, 1980",C,2.8,2.8,0.3,83.0,280,Right,"Toronto Raptors, 1st round (8th pick, 8th overall), 2004 NBA Draft",Brigham Young University,"Padre Anacleto  in  San Paulo,      Brazil  ",/players/a/araujra01.html
Stacey Arceneaux,1962,1962,"February 17, 1936",F,7.1,4.6,0.6,76.0,210,Right,,Iowa State University,"Taft  in  New York,        New York",/players/a/arcenst01.html
